{
  "format": "amadeus.spriteforge.character-pack.v1",
  "id": "minimal-example",
  "displayName": "Minimal Example",
  "version": "1.0.0",
  "textureFormat": "ktx2",
  "graph": "graph_config.json",
  "mouthConfig": "spriteforge_mouth_config.json",
  "clips": {
    "idle": {
      "phase": "loop",
      "frameIntervalMs": 250,
      "loopMode": "loop",
      "frames": ["textures/placeholder.ktx2"]
    },
    "idle_variant": {
      "phase": "loop",
      "frameIntervalMs": 250,
      "loopMode": "loop",
      "frames": ["textures/placeholder.ktx2"]
    },
    "speaking_short": {
      "phase": "loop",
      "frameIntervalMs": 125,
      "loopMode": "loop",
      "frames": ["textures/placeholder.ktx2"]
    }
  },
  "mouthOverlays": {},
  "clipCount": 3,
  "frameCount": 3,
  "textureCount": 1,
  "textureBytes": 289
}
